15:26:50.416349 IP 192.168.254.44.53776 > ham04s01-in-f3.1e100.net.http: Flags [S], seq 257867889, win 29200, options [mss 1460,sackOK,TS val 2083360 ecr 0,nop,wscale 6], length 0
E..<
Q@.@..w...,.:.....P.^.q......r............
... ........
15:26:50.437465 IP ham04s01-in-f3.1e100.net.http > 192.168.254.44.53776: Flags [S.], seq 2419511584, ack 257867890, win 64240, options [mss 1460], length 0
E..,.%.......:.....,.P...6. .^.r`...,.......
15:26:50.438499 IP 192.168.254.44.53776 > ham04s01-in-f3.1e100.net.http: Flags [.], ack 1, win 29200, length 0
E..(
R@.@......,.:.....P.^.r.6.!P.r..F........
15:26:56.037560 IP 192.168.254.44.53776 > ham04s01-in-f3.1e100.net.http: Flags [F.], seq 1, ack 1, win 29200, length 0
E..(
S@.@......,.:.....P.^.r.6.!P.r..E........
15:26:56.037779 IP ham04s01-in-f3.1e100.net.http > 192.168.254.44.53776: Flags [.], ack 2, win 64239, length 0
E..(.........:.....,.P...6.!.^.sP...Df..
15:26:56.058710 IP ham04s01-in-f3.1e100.net.http > 192.168.254.44.53776: Flags [FP.], seq 1, ack 2, win 64239, length 0
E..(. .......:.....,.P...6.!.^.sP...D]..
15:26:56.059649 IP 192.168.254.44.53776 > ham04s01-in-f3.1e100.net.http: Flags [.], ack 2, win 29200, length 0
E..(..@.@......,.:.....P.^.s.6."P.r..D........

