15:28:01.113811 IP 192.168.254.44.53780 > ham04s01-in-f227.1e100.net.http: Flags [S], seq 1588704206, win 29200, options [mss 1460,sackOK,TS val 2101034 ecr 0,nop,wscale 6], length 0
E..<..@.@......,.:.....P^.........r.t..........
. .*........
15:28:01.135415 IP ham04s01-in-f227.1e100.net.http > 192.168.254.44.53780: Flags [S.], seq 3033961442, ack 1588704207, win 64240, options [mss 1460], length 0
E..,.:.......:.....,.P......^...`...........
15:28:01.136009 IP 192.168.254.44.53780 > ham04s01-in-f227.1e100.net.http: Flags [.], ack 1, win 29200, length 0
E..(..@.@......,.:.....P^.......P.r..0........
15:28:06.137257 IP 192.168.254.44.53780 > ham04s01-in-f227.1e100.net.http: Flags [F.], seq 1, ack 1, win 29200, length 0
E..(..@.@......,.:.....P^.......P.r../........
15:28:06.137617 IP ham04s01-in-f227.1e100.net.http > 192.168.254.44.53780: Flags [.], ack 2, win 64239, length 0
E..(.........:.....,.P......^...P....P..
15:28:06.158971 IP ham04s01-in-f227.1e100.net.http > 192.168.254.44.53780: Flags [FP.], seq 1, ack 2, win 64239, length 0
E..(.........:.....,.P......^...P....G..
15:28:06.159256 IP 192.168.254.44.53780 > ham04s01-in-f227.1e100.net.http: Flags [.], ack 2, win 29200, length 0
E..(.C@.@......,.:.....P^.......P.r...........

