15:32:00.966261 IP (tos 0x0, ttl 64, id 59653, offset 0, flags [DF], proto TCP (6), length 60)
    192.168.254.44.59816 > 172.217.19.67.80: Flags [S], cksum 0x2eae (correct), seq 879628387, win 29200, options [mss 1460,sackOK,TS val 2160998 ecr 0,nop,wscale 6], length 0
E..<..@.@......,...C...P4n.c......r............
. .f........
15:32:00.975082 IP (tos 0x0, ttl 127, id 48869, offset 0, flags [none], proto TCP (6), length 44)
    172.217.19.67.80 > 192.168.254.44.59816: Flags [S.], cksum 0x023e (correct), seq 3858433839, ack 879628388, win 64240, options [mss 1460], length 0
E..,...........C...,.P...../4n.d`....>......
15:32:00.975244 IP (tos 0x0, ttl 64, id 59654, offset 0, flags [DF], proto TCP (6), length 40)
    192.168.254.44.59816 > 172.217.19.67.80: Flags [.], cksum 0xa2db (correct), seq 879628388, ack 3858433840, win 29200, length 0
E..(..@.@......,...C...P4n.d...0P.r...........
15:32:06.151165 IP (tos 0x0, ttl 64, id 59655, offset 0, flags [DF], proto TCP (6), length 40)
    192.168.254.44.59816 > 172.217.19.67.80: Flags [F.], cksum 0xa2da (correct), seq 879628388, ack 3858433840, win 29200, length 0
E..(..@.@......,...C...P4n.d...0P.r...........
15:32:06.151422 IP (tos 0x0, ttl 127, id 48995, offset 0, flags [none], proto TCP (6), length 40)
    172.217.19.67.80 > 192.168.254.44.59816: Flags [.], cksum 0x19fb (correct), seq 3858433840, ack 879628389, win 64239, length 0
E..(.c.....z...C...,.P.....04n.eP.......
15:32:06.160127 IP (tos 0x0, ttl 127, id 48996, offset 0, flags [none], proto TCP (6), length 40)
    172.217.19.67.80 > 192.168.254.44.59816: Flags [FP.], cksum 0x19f2 (correct), seq 3858433840, ack 879628389, win 64239, length 0
E..(.d.....y...C...,.P.....04n.eP.......
15:32:06.160350 IP (tos 0x0, ttl 64, id 13069, offset 0, flags [DF], proto TCP (6), length 40)
    192.168.254.44.59816 > 172.217.19.67.80: Flags [.], cksum 0xa2d9 (correct), seq 879628389, ack 3858433841, win 29200, length 0
E..(3.@.@......,...C...P4n.e...1P.r...........

